{
  "$schema": "https://json-schema.org/draft/2020-12/schema",
  "$id": "https://github.com/besanson/sarc-authority-derivation/schemas/derivation_output.schema.json",
  "title": "Paper 5 derivation output (Definitions 1-3)",
  "description": "derive.py's output: the minimal participation set P* (Definition 2) and the derived coverage list (Definition 3, the declared residue), plus enough provenance to reproduce and machine-check the run. One file per derivation run; checkers/participation_check.py reads this alongside pair-test-grid.yaml and loss-model.yaml to verify soundness and minimality exhaustively.",
  "type": "object",
  "required": [
    "schema_version", "loss_model_sha256", "grid_sha256", "candidate_properties",
    "participating_properties", "coverage_list", "witnesses", "grid_size_reachable"
  ],
  "additionalProperties": false,
  "properties": {
    "schema_version": { "const": 1 },
    "loss_model_sha256": {
      "type": "string",
      "description": "sha256 of prereg/loss-model.yaml's bytes at derivation time -- freshness stamp, same inputs_hash pattern as checkers/_provenance.py."
    },
    "grid_sha256": {
      "type": "string",
      "description": "sha256 of prereg/pair-test-grid.yaml's bytes at derivation time."
    },
    "candidate_properties": {
      "type": "array",
      "description": "Every property Definition 1 was swept over -- the union of participating_properties and coverage_list; always equal to pair-test-grid.yaml's twelve declared rows.",
      "items": { "type": "string" },
      "minItems": 1
    },
    "participating_properties": {
      "type": "array",
      "description": "P* (Definition 2): properties for which at least one witness pair exists. Sorted, deduplicated.",
      "items": { "type": "string" }
    },
    "coverage_list": {
      "type": "array",
      "description": "Definition 3: candidate_properties minus participating_properties -- the derived residue emitted honestly rather than silently dropped.",
      "items": { "type": "string" }
    },
    "witnesses": {
      "type": "object",
      "description": "For each participating property, at least one witness pair (a, a') from the executable-reachable set differing only in that property, with the loss id whose verdict differs between them -- the evidence a human or checker can replay without re-running the sweep.",
      "additionalProperties": {
        "type": "array",
        "minItems": 1,
        "items": {
          "type": "object",
          "required": ["loss_id", "tuple_a", "tuple_a_prime", "verdict_a", "verdict_a_prime"],
          "additionalProperties": false,
          "properties": {
            "loss_id": { "type": "string" },
            "tuple_a": { "type": "object" },
            "tuple_a_prime": { "type": "object" },
            "verdict_a": { "type": "boolean" },
            "verdict_a_prime": { "type": "boolean" }
          }
        }
      }
    },
    "grid_size_reachable": {
      "type": "integer",
      "minimum": 0,
      "description": "Count of executable-reachable tuples actually enumerated (post reachability filtering, rank-0 union remediation-reachable) -- a generated number, reported here so no paper claim of exhaustiveness can go unverified against it."
    },
    "generated_at_head_sha": {
      "type": "string",
      "description": "git HEAD at generation time -- informational, per checkers/_provenance.py's own head_sha()/inputs_hash() distinction (freshness is defined by the two *_sha256 fields above, not this one)."
    }
  }
}
